{
  "schema_version": 1,
  "id": "E19",
  "phase": "P6",
  "title": "Desktop Experience",
  "objective": "Add a cross-platform desktop client only after CLI/TUI/Guardian domain contracts are stable.",
  "dependencies": [
    "E15"
  ],
  "status": "in_progress",
  "stories": [
    {
      "id": "E19-S01",
      "title": "Desktop API boundary",
      "status": "done",
      "outcome": "Expose a narrow local IPC/API that reuses engine plans and explanations.",
      "change_risk": "CR3",
      "dependencies": [
        "E15-S04"
      ],
      "acceptance_criteria": [
        "Desktop cannot bypass safety executor.",
        "API is local-authenticated and versioned.",
        "If a local client connects without the session token, with a wrong token, or before authenticating, then the API shall refuse the request, disclose no engine data, and close the connection.",
        "If a client requests an API version the engine does not support, then the API shall refuse it and name the versions it supports.",
        "The API shall expose read-only documents only - the same inventory and plan documents the CLI's `status --json` and `plan --json` produce - and no request that performs or schedules a mutation."
      ],
      "safety_obligations": [],
      "verification": [
        "Unauthorized local client and schema compatibility tests."
      ],
      "documentation_impact": [
        "docs/architecture/TARGET.md"
      ]
    },
    {
      "id": "E19-S02",
      "title": "Cross-platform desktop shell",
      "status": "in_progress",
      "outcome": "Implement tray/menu-bar/dashboard experience using shared core, with Tauri or an equivalent evidence-backed choice.",
      "change_risk": "CR1",
      "dependencies": [
        "E19-S01"
      ],
      "acceptance_criteria": [
        "Desktop is optional and core remains headless-capable.",
        "UI shows the same inventory/policy semantics as CLI/TUI."
      ],
      "safety_obligations": [],
      "verification": [
        "View-model parity tests."
      ],
      "documentation_impact": [
        "docs/PRODUCT.md"
      ]
    }
  ]
}
