{
  "schema_version": 1,
  "id": "E07",
  "phase": "P2",
  "title": "Cross-Platform Operating-System Layer",
  "objective": "Make macOS, Linux, Windows native, and WSL2 first-class platform targets.",
  "dependencies": [
    "E06"
  ],
  "status": "planned",
  "stories": [
    {
      "id": "E07-S01",
      "title": "Unix platform backend",
      "status": "planned",
      "outcome": "Implement macOS/Linux process, identity, allocated-size, notification, and filesystem semantics behind OS capabilities.",
      "change_risk": "CR3",
      "dependencies": [
        "E06-S04"
      ],
      "acceptance_criteria": [
        "macOS and Linux behavior uses explicit capability checks rather than cfg sprawl in domain code.",
        "Unsupported filesystem features lower capability safely."
      ],
      "safety_obligations": [],
      "verification": [
        "macOS/Linux CI and filesystem integration suites."
      ],
      "documentation_impact": [
        "docs/architecture/PLATFORM_MODEL.md"
      ]
    },
    {
      "id": "E07-S02",
      "title": "Windows native backend",
      "status": "planned",
      "outcome": "Implement Windows path, volume/file identity, reparse point, process, allocated-size, and atomic move semantics.",
      "change_risk": "CR4",
      "dependencies": [
        "E07-S01"
      ],
      "acceptance_criteria": [
        "Reparse points are never treated as Unix symlinks by assumption.",
        "Drive/volume boundaries constrain quarantine and mutation."
      ],
      "safety_obligations": [
        "SI-017",
        "SI-018"
      ],
      "verification": [
        "Windows CI with junction/symlink/reparse adversarial fixtures."
      ],
      "documentation_impact": [
        "docs/architecture/PLATFORM_MODEL.md"
      ]
    },
    {
      "id": "E07-S03",
      "title": "WSL environment model",
      "status": "planned",
      "outcome": "Treat WSL as Windows host plus Linux guest/filesystem context rather than generic Linux.",
      "change_risk": "CR3",
      "dependencies": [
        "E07-S02"
      ],
      "acceptance_criteria": [
        "WSL detection is explicit.",
        "/mnt/* crossings are separately classified and performance/safety caveats surfaced."
      ],
      "safety_obligations": [],
      "verification": [
        "WSL integration smoke suite where available plus simulated path fixtures."
      ],
      "documentation_impact": [
        "docs/architecture/PLATFORM_MODEL.md"
      ]
    },
    {
      "id": "E07-S04",
      "title": "Tiered platform support contract",
      "status": "planned",
      "outcome": "Publish Tier 1/Tier 2 platform capability matrix and support policy.",
      "change_risk": "CR1",
      "dependencies": [
        "E07-S01",
        "E07-S02",
        "E07-S03"
      ],
      "acceptance_criteria": [
        "No platform is called supported without required CI and destructive safety fixtures.",
        "Unsupported OSes remain inspect-only or refused explicitly."
      ],
      "safety_obligations": [],
      "verification": [
        "Generated platform matrix check."
      ],
      "documentation_impact": [
        "README.md",
        "docs/PLATFORMS.md"
      ]
    },
    {
      "id": "E07-S05",
      "title": "Linux TOCTOU identity/mutation test reliability",
      "status": "planned",
      "outcome": "Determine why cancellai-platform's identity::tests::toctou_file_deleted_and_recreated_with_identical_content_still_changes_identity and mutation::tests::confirmed_delete_rejects_a_target_already_swapped_before_open fail intermittently on Linux CI (ubuntu-latest, observed across multiple runs on 2026-08-31) while never observed failing on macOS, and close whichever of a test-fixture gap or a real IdentityToken weakness it turns out to be.",
      "change_risk": "CR3",
      "dependencies": [
        "E03-S01"
      ],
      "acceptance_criteria": [
        "Root cause is determined and documented: either the test fixture's delete-and-recreate timing does not reliably force a genuinely different identity under Linux's inode-reuse/mtime-resolution characteristics (a fixture gap), or IdentityToken::Unix's device+inode+kind+modified tuple can under real conditions fail to distinguish two different filesystem objects (a real SI-013/SI-017 gap).",
        "If a fixture gap: the fixture is corrected to reliably force a distinguishable identity (e.g. content/size difference) without weakening what the test verifies. If a real gap: IdentityToken/revalidate gains whatever disambiguator closes it (e.g. a higher-resolution timestamp source or an additional generation/creation-time field), with a regression test that fails without the fix.",
        "Both named tests pass with no observed flakiness across at least 20 consecutive ubuntu-latest CI runs after the fix."
      ],
      "safety_obligations": [
        "SI-013",
        "SI-017"
      ],
      "verification": [
        "Repeated ubuntu-latest CI runs (or a local repeated-run harness) with no flake; a targeted stress reproduction forcing rapid delete+recreate cycles."
      ],
      "documentation_impact": [
        "docs/security/SAFETY_INVARIANTS.md"
      ]
    },
    {
      "id": "E07-S06",
      "title": "Windows inventory scan traversal test reliability",
      "status": "planned",
      "outcome": "Determine why cancellai-inventory's completeness::tests::ac1_a_fully_readable_tree_is_complete and scan::tests::ac1_one_traversal_visits_every_directory_exactly_once fail on Windows CI (observed 2026-08-31, the first time the Windows quality job in rust.yml ever actually reached these tests - an unrelated pre-existing clippy::large_enum_variant failure had aborted that job before test execution since at least 2026-08-29), and bring cancellai-inventory to genuine, verified Windows parity or document the gap explicitly.",
      "change_risk": "CR2",
      "dependencies": [
        "E04-S02",
        "E04-S03"
      ],
      "acceptance_criteria": [
        "Root cause identified: a path-separator, symlink/junction-detection, or traversal-count assumption in scan_scope/derive_completeness that does not hold on Windows.",
        "scan_scope/derive_completeness produce the same documented Complete/Partial/Unknown classification and traversal counters (directories_visited, paths_observed) on Windows as on macOS/Linux for the same fixture tree, or the platform difference is explicitly documented in PLATFORM_MODEL.md as a known, accepted Windows limitation rather than silently left failing."
      ],
      "safety_obligations": [
        "SI-008",
        "SI-009"
      ],
      "verification": [
        "quality (windows-latest) in rust.yml green across repeated runs."
      ],
      "documentation_impact": [
        "docs/architecture/PLATFORM_MODEL.md"
      ]
    },
    {
      "id": "E07-S07",
      "title": "Provider-root link authority boundary",
      "status": "planned",
      "outcome": "Reject provider roots whose root object or path resolution crosses a symbolic-link, junction, or reparse boundary before any Rust CLI mutation or provider configuration write.",
      "change_risk": "CR4",
      "dependencies": [
        "E03-S03",
        "E03-S05",
        "E06-S01"
      ],
      "acceptance_criteria": [
        "A default-named Claude or Codex root that is itself a link/reparse point is inspection-only and cannot be cleaned or configured.",
        "Root identity and containment revalidation reject link/reparse drift at plan and execution time on every supported platform.",
        "Unix symlink and Windows junction/reparse adversarial fixtures prove no provider mutation reaches the link target."
      ],
      "safety_obligations": [
        "SI-002",
        "SI-003",
        "SI-013",
        "SI-019"
      ],
      "verification": [
        "Adversarial root-link/reparse clean and configure tests on every claimed platform.",
        "Independent CR4 Safety Verdict."
      ],
      "documentation_impact": [
        "docs/architecture/PLATFORM_MODEL.md",
        "docs/CLI_RUST.md",
        "docs/security/SAFETY_INVARIANTS.md"
      ]
    },
    {
      "id": "E07-S08",
      "title": "Differential semantic parity projection",
      "status": "planned",
      "outcome": "Make the Python/Rust parity gate prove approved, fixture-specific semantic equivalence beyond deletion UUIDs and root state.",
      "change_risk": "CR2",
      "dependencies": [
        "E01-S05",
        "E06-S02"
      ],
      "acceptance_criteria": [
        "A divergence allow-list is structured and validates that its cited accepted ADR/RFC specifically authorizes the fixture and semantic difference being suppressed.",
        "The comparison projects discovered identity records, protection/unknown coverage, scan completeness, root authority, and all proposed actions for every NORMATIVE fixture.",
        "Injected divergences for every projected field, including an unrelated accepted ADR citation, fail the gate."
      ],
      "safety_obligations": [
        "SI-001",
        "SI-008",
        "SI-009",
        "SI-023"
      ],
      "verification": [
        "Semantic-projection injected-divergence suite.",
        "Full NORMATIVE corpus run in default and custom-root scenarios."
      ],
      "documentation_impact": [
        "docs/development/MIGRATION_PYTHON_RUST.md",
        "docs/development/VERIFICATION_STRATEGY.md"
      ]
    }
  ]
}
