{
  "schema_version": 1,
  "id": "E10",
  "phase": "P2",
  "title": "Storage Accounting and Performance",
  "objective": "Make storage numbers trustworthy and the scanner inexpensive enough for continuous use.",
  "dependencies": [
    "E08"
  ],
  "status": "done",
  "stories": [
    {
      "id": "E10-S01",
      "title": "Reclaimability estimator",
      "status": "done",
      "outcome": "Distinguish logical size, allocated size, shared/clone uncertainty, and expected reclaim on supported filesystems.",
      "change_risk": "CR2",
      "dependencies": [
        "E04-S01",
        "E20-S03"
      ],
      "acceptance_criteria": [
        "Estimates are labeled by confidence.",
        "Unknown APFS/reflink/shared-block effects are never presented as guaranteed savings."
      ],
      "safety_obligations": [],
      "verification": [
        "Filesystem-specific integration tests and conservative fallback tests."
      ],
      "documentation_impact": [
        "docs/architecture/PLATFORM_MODEL.md"
      ]
    },
    {
      "id": "E10-S02",
      "title": "Performance guardrails",
      "status": "done",
      "outcome": "Enforce latency/memory/self-footprint regression budgets.",
      "change_risk": "CR1",
      "dependencies": [
        "E04-S04"
      ],
      "acceptance_criteria": [
        "Fast CI benchmarks catch large regressions.",
        "Scheduled deep benchmarks publish trends without blocking ordinary PRs on noisy metrics."
      ],
      "safety_obligations": [],
      "verification": [
        "Benchmark workflow and regression-threshold unit tests."
      ],
      "documentation_impact": [
        "docs/development/RELEASE_GATES.md"
      ]
    },
    {
      "id": "E10-S03",
      "title": "Verifier repair: reclaim probe authority and risk correction",
      "status": "done",
      "outcome": "Independent review found E10-S01's CR2 declaration below the CR4 floor because its released batch added unsafe macOS statfs FFI to cancellai-sealedfs. Record the independent CR4 classification without rewriting shipped E10-S01, place the FFI authority in an ADR, and preserve the probe's conservative read-only behaviour.",
      "change_risk": "CR4",
      "dependencies": [
        "E10-S01"
      ],
      "acceptance_criteria": [
        "The independent CR4 classification of released E10-S01 is visible in the risk-classification control plane.",
        "An accepted ADR authorizes the narrowly scoped statfs FFI in cancellai-sealedfs and names its safety and compatibility limits.",
        "If a probe path contains an interior NUL, is missing, or yields a non-UTF-8 type name, then the system shall reject or downgrade the observation without granting mutation authority."
      ],
      "safety_obligations": [
        "SI-016"
      ],
      "verification": [
        "Native macOS sealedfs and platform tests exercise real and missing paths; Miri is attempted and any unavailable component is recorded.",
        "The CR4 Safety Verdict names the FFI boundary, test evidence, residual platform limits, and owner-authorized acceptance."
      ],
      "documentation_impact": [
        "docs/adrs/0027-macos-statfs-filesystem-observation-in-sealedfs.md",
        "docs/architecture/PLATFORM_MODEL.md"
      ]
    }
  ]
}
