{
  "schema_version": 1,
  "id": "E02",
  "phase": "P1",
  "title": "Rust Workspace Bootstrap",
  "objective": "Establish the target Rust workspace, coding standards, and build factory without changing user-visible behavior.",
  "dependencies": [
    "E01"
  ],
  "status": "done",
  "stories": [
    {
      "id": "E02-S01",
      "title": "Create Rust workspace skeleton",
      "status": "done",
      "outcome": "Create crates for model, safety, inventory, policy, provider API, store, CLI, TUI, and later Guardian.",
      "change_risk": "CR1",
      "dependencies": [
        "E01-S06"
      ],
      "acceptance_criteria": [
        "Workspace builds on macOS, Linux, and Windows tier-1 toolchains.",
        "Crate dependency direction follows target architecture and has no cycles.",
        "No provider-specific code is placed in core model/safety crates."
      ],
      "safety_obligations": [],
      "verification": [
        "cargo check --workspace on CI matrix."
      ],
      "documentation_impact": [
        "docs/architecture/TARGET.md"
      ]
    },
    {
      "id": "E02-S02",
      "title": "Establish Rust quality baseline",
      "status": "done",
      "outcome": "Adopt fmt, clippy, tests, cargo-deny, RustSec audit, MSRV policy, and dependency rules.",
      "change_risk": "CR1",
      "dependencies": [
        "E02-S01"
      ],
      "acceptance_criteria": [
        "Warnings are denied in CI for project code.",
        "Unknown registries/git sources are denied unless explicitly approved.",
        "License allowlist is documented."
      ],
      "safety_obligations": [],
      "verification": [
        "Quality workflow fails on injected lint and denied dependency fixtures."
      ],
      "documentation_impact": [
        "docs/development/RELEASE_GATES.md",
        "docs/security/SUPPLY_CHAIN.md"
      ]
    },
    {
      "id": "E02-S03",
      "title": "Define error and diagnostic model",
      "status": "done",
      "outcome": "Create typed error categories and stable machine-facing exit mapping.",
      "change_risk": "CR2",
      "dependencies": [
        "E02-S01"
      ],
      "acceptance_criteria": [
        "Errors separate invalid input, safety block, incomplete inventory, compatibility failure, mutation failure, and internal fault.",
        "Human and JSON diagnostics share stable error codes."
      ],
      "safety_obligations": [],
      "verification": [
        "Golden diagnostic tests across all categories."
      ],
      "documentation_impact": [
        "docs/CLI.md",
        "docs/architecture/DOMAIN_MODEL.md"
      ]
    },
    {
      "id": "E02-S04",
      "title": "Introduce deterministic clock and filesystem seams",
      "status": "done",
      "outcome": "Make time and filesystem observation injectable for tests without abstracting away security-critical OS semantics.",
      "change_risk": "CR2",
      "dependencies": [
        "E02-S01"
      ],
      "acceptance_criteria": [
        "Tests can freeze time and synthesize filesystem facts.",
        "Production paths still use explicit OS-backed implementations."
      ],
      "safety_obligations": [],
      "verification": [
        "Determinism test repeats plan generation byte-for-byte."
      ],
      "documentation_impact": [
        "docs/development/VERIFICATION_STRATEGY.md"
      ]
    }
  ]
}
