{
  "schema_version": 1,
  "id": "E20",
  "phase": "P2",
  "title": "Windows and WSL Native Support",
  "objective": "Make Windows native and WSL2 first-class platform targets, once a real Windows/WSL development or CI environment is available to verify against.",
  "dependencies": [],
  "status": "done",
  "stories": [
    {
      "id": "E20-S01",
      "title": "Windows native backend",
      "status": "done",
      "outcome": "Implement Windows path/volume/file identity and reparse-point classification (ADR-0020), scoped exactly to this story's own acceptance criteria. E20-S01 round-1 independent verifier review (project/evidence/E20-VERIFIER-REVIEW.md) found the original, broader outcome text implied Windows process observation, allocated-size, atomic-move, and full mutation/quarantine capability too, and required this scope be narrowed through the story contract rather than left as unreviewed evidence-packet prose - owner-authorized narrowing recorded here; the deferred capabilities are E20-S05.",
      "change_risk": "CR4",
      "dependencies": [
        "E07-S01"
      ],
      "acceptance_criteria": [
        "Reparse points are never treated as Unix symlinks by assumption.",
        "Drive/volume boundaries constrain quarantine and mutation."
      ],
      "safety_obligations": [
        "SI-017",
        "SI-018"
      ],
      "verification": [
        "Windows CI with junction/symlink/reparse adversarial fixtures."
      ],
      "documentation_impact": [
        "docs/architecture/PLATFORM_MODEL.md"
      ]
    },
    {
      "id": "E20-S02",
      "title": "WSL environment model",
      "status": "done",
      "outcome": "Treat WSL as Windows host plus Linux guest/filesystem context rather than generic Linux.",
      "change_risk": "CR3",
      "dependencies": [
        "E20-S01"
      ],
      "acceptance_criteria": [
        "WSL detection is explicit.",
        "/mnt/* crossings are separately classified and performance/safety caveats surfaced."
      ],
      "safety_obligations": [],
      "verification": [
        "WSL integration smoke suite where available plus simulated path fixtures."
      ],
      "documentation_impact": [
        "docs/architecture/PLATFORM_MODEL.md"
      ]
    },
    {
      "id": "E20-S03",
      "title": "Tiered platform support contract",
      "status": "done",
      "outcome": "Publish Tier 1/Tier 2 platform capability matrix and support policy.",
      "change_risk": "CR1",
      "dependencies": [
        "E07-S01",
        "E20-S01",
        "E20-S02"
      ],
      "acceptance_criteria": [
        "No platform is called supported without required CI and destructive safety fixtures.",
        "Unsupported OSes remain inspect-only or refused explicitly."
      ],
      "safety_obligations": [],
      "verification": [
        "Generated platform matrix check."
      ],
      "documentation_impact": [
        "README.md",
        "docs/PLATFORMS.md"
      ]
    },
    {
      "id": "E20-S04",
      "title": "Windows inventory scan traversal test reliability",
      "status": "done",
      "outcome": "Determine why cancellai-inventory's completeness::tests::ac1_a_fully_readable_tree_is_complete and scan::tests::ac1_one_traversal_visits_every_directory_exactly_once fail on Windows CI (observed 2026-08-31, the first time the Windows quality job in rust.yml ever actually reached these tests - an unrelated pre-existing clippy::large_enum_variant failure had aborted that job before test execution since at least 2026-08-29), and bring cancellai-inventory to genuine, verified Windows parity or document the gap explicitly.",
      "change_risk": "CR2",
      "dependencies": [
        "E04-S02",
        "E04-S03"
      ],
      "acceptance_criteria": [
        "Root cause identified: a path-separator, symlink/junction-detection, or traversal-count assumption in scan_scope/derive_completeness that does not hold on Windows.",
        "scan_scope/derive_completeness produce the same documented Complete/Partial/Unknown classification and traversal counters (directories_visited, paths_observed) on Windows as on macOS/Linux for the same fixture tree, or the platform difference is explicitly documented in PLATFORM_MODEL.md as a known, accepted Windows limitation rather than silently left failing."
      ],
      "safety_obligations": [
        "SI-008",
        "SI-009"
      ],
      "verification": [
        "quality (windows-latest) in rust.yml green across repeated runs."
      ],
      "documentation_impact": [
        "docs/architecture/PLATFORM_MODEL.md"
      ]
    },
    {
      "id": "E20-S05",
      "title": "Windows process observation, allocated-size, atomic move, and mutation authority",
      "status": "done",
      "outcome": "Implement the Windows capabilities named by E20-S01's original outcome text but ruled out of that story's scope by round-1 independent verifier review: native process/activity observation, allocated-size reporting (GetCompressedFileSizeW), atomic rename/move semantics, and - the largest piece - a verified no-follow, handle-relative root-establishment walk in cancellai-sealedfs (extending ADR-0020) so cancellai-safety::mutation_executor can grant real deletion authority on Windows, matching the scrutiny SI-019/E21-S07 already applies on Unix.",
      "change_risk": "CR4",
      "dependencies": [
        "E20-S01"
      ],
      "acceptance_criteria": [
        "Windows process/activity observation reports real running-process facts, not an unconditional Unsupported/incomplete result.",
        "Allocated-size observation is implemented and distinct from logical size on Windows, matching AllocationObserver's existing Absent/Unreadable/Unsupported contract.",
        "A verified no-follow, handle-relative directory-establishment capability exists for Windows (extending or replacing cancellai-sealedfs's Unsupported fallback there), closing the same TOCTOU class ADR-0017/E07-S09/E21-S07 close on Unix.",
        "Real Windows file deletion is implemented, identity-confirmed, and passes adversarial fixtures (symlink swap, junction, TOCTOU) on real Windows CI before docs/PLATFORMS.md may record Windows mutation as verified."
      ],
      "safety_obligations": [
        "SI-013",
        "SI-017",
        "SI-018",
        "SI-019"
      ],
      "verification": [
        "Windows CI (windows-latest) green across repeated runs, including adversarial TOCTOU/symlink/junction fixtures for the new mutation path.",
        "Generated platform matrix check (scripts/check_platforms.py) - Windows mutation.state may only become verified once this story's own evidence tests exist and pass on a verified_commit."
      ],
      "documentation_impact": [
        "docs/architecture/PLATFORM_MODEL.md",
        "docs/CLI_RUST.md",
        "docs/PLATFORMS.md",
        "project/platforms.json"
      ]
    }
  ]
}
