{
  "schema_version": 1,
  "id": "E33",
  "phase": "P5",
  "title": "Containment Notice Distribution",
  "objective": "ADR-0039 kept the network out of the Rust cutover: a signed containment notice reaches an installation only when its owner runs containment install. That makes the kill-switch as fast as a person reading an advisory. This epic adds the distribution channel ADR-0039 deferred: a fetch client that retrieves signed notices from a published feed, bounded in bytes before parsing, verified by the same trust policy, and never able to do more than the local install command can. It depends on the live ledger E06-S07 wires, not on E06 closing.",
  "dependencies": [],
  "status": "in_progress",
  "stories": [
    {
      "id": "E33-S01",
      "title": "Signed containment notices are fetched from a published feed",
      "status": "done",
      "outcome": "Fetch signed containment notices from a published feed and ingest them through the same path as containment install, so an incident reaches installations without a manual step, while an unreachable, oversized, stale or forged feed leaves the ledger exactly as it was. Owner decisions (2026-09-23): fetch with the system curl, no HTTP client in the binary; publish one cumulative signed notice as containment/notice.json in the canonical repository, fetched by an explicit containment refresh.",
      "change_risk": "CR4",
      "dependencies": [
        "E06-S07",
        "E33-S03"
      ],
      "acceptance_criteria": [
        "When the feed is reachable, the system shall ingest every new notice through the same verification and persistence path as containment install.",
        "If the feed is unreachable, oversized, malformed, replayed, rolled back or signed by an untrusted publisher, then the ledger's ordered event rows and their raw signed payloads shall stay identical and authority shall keep being computed from local state.",
        "The system shall never lift, narrow or loosen a containment from feed content."
      ],
      "safety_obligations": [
        "SI-022",
        "SI-029",
        "SI-030"
      ],
      "verification": [
        "Adversarial tests against a local test feed cover every refusal case, including a response larger than the byte cap."
      ],
      "documentation_impact": [
        "docs/security/INCIDENT_RESPONSE.md",
        "docs/security/SUPPLY_CHAIN.md"
      ]
    },
    {
      "id": "E33-S02",
      "title": "The Guardian refreshes containment on its schedule",
      "status": "planned",
      "outcome": "E33-S01 fetches a published notice only when the owner runs containment refresh. The owner wanted the Guardian to refresh on each cycle, but the Guardian's run command is still the E02-S01 skeleton and has no cycle to hook into, and the containment code lives in the CLI binary. This story runs the same refresh from the Guardian once its detection loop exists, which means first moving the containment runtime out of cancellai-cli into a library the Guardian can call.",
      "change_risk": "CR4",
      "dependencies": [
        "E33-S01"
      ],
      "acceptance_criteria": [
        "When the Guardian runs a cycle, the system shall refresh containment through the same verified path as containment refresh.",
        "If the refresh fails for any reason, then the Guardian shall keep running and the ledger's event rows shall stay identical.",
        "The system shall keep exactly one implementation of fetch, verification and persistence shared by the CLI and the Guardian."
      ],
      "safety_obligations": [
        "SI-022",
        "SI-029",
        "SI-030"
      ],
      "verification": [
        "A Guardian integration test drives a cycle against a fake feed and asserts the ledger before and after."
      ],
      "documentation_impact": [
        "docs/security/INCIDENT_RESPONSE.md",
        "docs/architecture/GUARDIAN_MODEL.md"
      ]
    },
    {
      "id": "E33-S03",
      "title": "The containment ledger is a SQLite table decided and appended in one transaction",
      "status": "done",
      "outcome": "The JSONL history decided from one read and appended in a separate write; rounds 8 and 9 found concurrent refreshes writing duplicate or losing lines, and a crash inside the write could leave a torn line (ADR-0040). The ledger is now a SQLite table: install, refresh and lift read, replay through cancellai-safety, decide and insert at most one row inside one BEGIN IMMEDIATE transaction.",
      "change_risk": "CR4",
      "dependencies": [
        "E06-S07"
      ],
      "acceptance_criteria": [
        "When containment is installed, refreshed or lifted, the system shall read the history, decide and insert at most one event row inside one database transaction.",
        "If a decision refuses, finds the notice already current, or loses to a concurrent change, then the system shall insert no row.",
        "If the process is interrupted before the transaction commits, then the history shall contain no part of the interrupted event.",
        "If the ledger database exists but cannot be opened, read or replayed, then authority shall be capped as for an unreadable ledger and nothing shall be written."
      ],
      "safety_obligations": [
        "SI-022",
        "SI-029"
      ],
      "verification": [
        "Store tests for commit/rollback and concurrent transactions; the 16-process refresh and 8-process install CLI tests assert one row per accepted event; a kill-point test kills the process inside the transaction and asserts the history replays with no partial event; a corrupt database caps authority."
      ],
      "documentation_impact": [
        "docs/adrs/0039-the-cutover-perimeter-binds-cli-authority-to-a-local-containment-ledger.md",
        "docs/security/INCIDENT_RESPONSE.md"
      ]
    }
  ]
}
